{
  "version": 1,
  "analysis_model": "ai-semantic-v1",
  "evidence_basis": {
    "packet_count_considered": 3,
    "primary_roles": ["user"],
    "supporting_roles": ["tool"],
    "source_limitations": ["Synthetic stale and conflicting evidence fixture."]
  },
  "candidates": [
    {
      "id": "conflicting-ci-loop",
      "name": "Conflicting CI Loop",
      "decision": "commit",
      "confidence": "high",
      "mechanisms": ["loop"],
      "score": 86,
      "evidence_quality": "stale_or_conflicting",
      "uncertainty": ["The available CI evidence is stale and conflicts with a newer status packet."],
      "summary": "CI failure handling looks repeatable, but the evidence conflicts across packets.",
      "user_semantics": ["The user previously asked for CI triage, but the latest evidence may no longer match the current project state."],
      "tool_patterns": ["One tool status says failed while another later status implies green."],
      "failure_paths": ["Acting on stale CI status would create unnecessary or wrong fixes."],
      "verifier_habits": ["Use current CI status before patching."],
      "approval_boundaries": ["push", "merge"],
      "why_this_loop": "The shape is loop-like, but the evidence is not current enough for delegation.",
      "why_not_smaller": "Until evidence is fresh, a checklist is safer than a managed loop.",
      "why_not_more_autonomous": "Stale or conflicting verifier evidence must return to the user or a fresh read-only pass.",
      "where_this_may_be_wrong": ["Evidence is stale.", "Packets conflict on the current CI status."],
      "evidence": [
        {
          "source": "session:synthetic-ci-1#event-1",
          "kind": "verification-request",
          "role": "user",
          "intent": "inspect_failed_ci_before_guessing",
          "snippet": "CI is red again."
        },
        {
          "source": "session:synthetic-ci-2#event-3",
          "kind": "verification-request",
          "role": "user",
          "intent": "wait_read_log_patch_failing_test",
          "snippet": "Same pattern as last time."
        },
        {
          "source": "session:synthetic-ci-2#event-4",
          "kind": "tool-status",
          "role": "tool",
          "intent": "conflicting_ci_status",
          "snippet": "older failed status conflicts with newer green status"
        }
      ],
      "trigger": ["CI status is failed or unclear."],
      "inputs": ["CI status", "failed job logs", "git diff"],
      "actions": ["Refresh CI status.", "Read failed job logs.", "Patch only evidenced failures."],
      "verification": ["Current CI status is checked.", "Focused local test passes."],
      "stop_conditions": ["Evidence is stale.", "CI status conflicts.", "Push or merge is required."],
      "managed_loop": {
        "objective": "Keep CI failures moving toward a verified fix without guessing.",
        "cadence_or_trigger": ["When CI is pending or failed on the current branch."],
        "state_file": ".sixloops/state/conflicting-ci-loop.json",
        "state_schema": {
          "status": "Current loop status.",
          "items": "Tracked failures.",
          "attempts": "Attempt log.",
          "next_cursor": "Resume cursor."
        },
        "cycle_steps": [
          "Read previous state.",
          "Refresh CI status and logs.",
          "Pick at most 1-3 actionable failures.",
          "Attempt only low-risk fixes with fresh evidence.",
          "Verify and record state."
        ],
        "selection_policy": ["Prefer fresh CI evidence."],
        "max_items_per_cycle": 3,
        "max_iterations_per_run": 4,
        "completion_contract": {
          "success_criteria": ["Current CI status is checked.", "Focused local test passes."],
          "verifier_commands": ["Run focused verifier after refreshing CI status."],
          "evaluator_agent": "Use deterministic checks first.",
          "pass_evidence_required": ["Fresh CI status and command output."],
          "reject_conditions": ["Evidence is stale.", "CI status conflicts.", "Push or merge required."],
          "no_progress_policy": "Stop if evidence remains stale or conflicting after one refresh."
        },
        "loop_exit_contract": {
          "continue_only_if": ["Fresh CI evidence is available.", "Objective is unchanged.", "Fewer than 4 iteration(s) have run."],
          "done_when": ["Current CI status is checked.", "Focused local test passes."],
          "needs_human_when": ["push is required.", "merge is required.", "evidence remains conflicting."],
          "blocked_when": ["Evidence is stale.", "CI status conflicts."],
          "budget_stopped_when": ["4 iteration(s) are reached."],
          "status_protocol": {
            "CONTINUE": "Only when another cycle can increase verified certainty.",
            "DONE": "Acceptance checks passed with required evidence; return for acceptance.",
            "NEEDS_HUMAN": "Return for review because human judgment or explicit approval is required.",
            "BLOCKED": "Reliable progress is not possible with current evidence or verifier.",
            "BUDGET_STOPPED": "Item, iteration, time, token, or cost cap was reached."
          }
        },
        "resume_policy": "Read the state file and refresh evidence before continuing.",
        "failure_policy": "Stop if evidence remains stale or conflicting."
      },
      "safety": {
        "autonomy_level": "draft-only",
        "requires_approval_for": ["push", "merge"],
        "budget_caps": ["Stop after 4 iterations per run."]
      },
      "artifacts": ["loop-card"]
    }
  ]
}
